{"artifact_classification":"PRE_DISTRIBUTION_HUMAN_PACKET_PREPARATION_ONLY","authoritative_inputs":[{"path":"orchestration/results/146_construct_validity_source_blindness.txt","sha256":"sha256:60022b06bd86827d7d508f8d675ec9ea57beb2b6120de5ed424dfde8cfff2d11"},{"path":"orchestration/results/149_cvpr_pivot_v2_addendum.txt","sha256":"sha256:77892de8764efb8187d9f1ef95a93141d29628a68bfd7e1044a093db78b7b6a5"},{"path":"orchestration/results/153_semantic_av_source_prescreen_tooling.txt","sha256":"sha256:92f5b4f0510e7cd42408766f25757b3d9211456c0447c1de0721fc1771095fb6"},{"path":"orchestration/results/171_epic_dev_authoring_packets.txt","sha256":"sha256:135229f19fb814a16d79f0fb18a50b98a2373ab8acffd3b0a46d3a355b2a376c"},{"path":"orchestration/results/192_pilot_v3_candidate_integration.txt","sha256":"sha256:a3bb3ccc18eb2a39b1346109ed17c828285e2d7ae2de6117170b8e472dc7fa95"},{"path":"orchestration/results/193_semantic_audio_discovery.txt","sha256":"sha256:9c3e1eb073e0cfb844bd9c5523f8c0227266c91f75c9ed64b8d22fd8c0fb0389"},{"path":"orchestration/results/194_audio_candidate_prescreen_packets.txt","sha256":"sha256:e888a3ab4156f97f982ab531a82f4237ed2e8df70059be24355304a944a5d834"},{"path":"orchestration/results/195_pilot_v4_candidate_integration.txt","sha256":"sha256:783f0662425984081c2c8a099ae103d98110098caeaa660af731fa8cc4418989"},{"path":"data/rehearsal_plan/pilot_v4_candidate_matrix.json","sha256":"sha256:61064eff782cc068f8e58e2829b016f216f71668c897ceca71f99642a78e11b7"},{"path":"data/rehearsal_plan/audio_candidate_prescreen_packets_v1/coordinator/packet_manifest.json","sha256":"sha256:ce2127558bd1aec31387d03f00420e5bea69fa6bbf77c20cc2540f8f35e85987"},{"path":"data/restricted/epic_family_candidates_v2_dev/candidate_registry.json","sha256":"sha256:ab0d4e70d912b9fe7bf7f84c48d717ba1809b1ac6ca4ed67464644e5d26bca5d"},{"path":"data/restricted/captaincook4d_family_candidates_v1_dev/candidate_registry.json","sha256":"sha256:23ee9356b530fe9d7bace1948f55818a590736b6c264438bf9f13abcbfac62fa"},{"path":"data/restricted/mini_pilot_family_candidates_v2_dev/candidate_registry.json","sha256":"sha256:26831f0e204a2f68e93560ee6a7807ea4697d3b482dc597f94599699445c418e"},{"path":"data/candidates/source_candidates.csv","sha256":"sha256:b00f3a2045aafea8517f232080c87433292fe9d84430739a4c7a89b7d833923b"}],"blindness_contract":{"audio_inspection_order":["audio_only_focal","synchronized_av_focal","audio_only_recurrence_probes"],"audio_prescreen_hypotheses_visible":false,"author_only_assigned_slot_hypotheses_visible":true,"author_sibling_slot_hypotheses_visible":false,"prescreener_candidate_hypotheses_visible":false,"prescreener_sibling_slot_hypotheses_visible":false,"source_level_blind_role_exclusions":["blind_alternative_evidence_finder","blind_post_adjudication_saturation_auditor"],"source_level_exposure_required":true},"construct_boundary":{"accepted_ses_count":0,"gate_a_go":false,"h1_assigned":false,"h2_assigned":false,"human_gold":false,"minimality_assigned":false,"necessity_assigned":false,"public_release_authorized":false,"scientific_execution_authorized":false},"created_date":"2026-10-10","distribution_authorized":false,"excluded_calibration_packets":[{"calibration_id":"task199.excluded-calibration.01","excluded_from_pilot_denominator":true,"human_decision_recorded":false,"path":"calibrations/excluded_01.json","sha256":"sha256:a8afd167f0762fc4259d3af5d06d2642e7115495b83c1fdeb79cb8f2e0a6c813"},{"calibration_id":"task199.excluded-calibration.02","excluded_from_pilot_denominator":true,"human_decision_recorded":false,"path":"calibrations/excluded_02.json","sha256":"sha256:43ed6141edc3bdf57b3a3c67dc1432bd7b7ae89e754700a0c7119c6c938742ac"}],"matrix_binding":{"file_sha256":"sha256:61064eff782cc068f8e58e2829b016f216f71668c897ceca71f99642a78e11b7","matrix_decision_token":"PILOT_V4_CANDIDATE_MATRIX_REPAIR","matrix_id":"av-trace-pilot-v4-prospective-candidate-matrix-task195","path":"data/rehearsal_plan/pilot_v4_candidate_matrix.json"},"packet_status":"DRAFT_NOT_DISTRIBUTABLE","record_type":"pilot_v4_human_packet_registry","registry_id":"pilot-v4-human-packets-task199","registry_payload_sha256":"sha256:c5f894fc53fe80731851bf04236ca278e54843bbcc09dfae4f464aafa0ad50d4","rights_release_boundaries":[{"boundary":{"human_annotation_authority":"NOT_GRANTED_BY_TASK162_SOURCE_MANIFEST","license_evidence":"EPIC-KITCHENS-100 project/annotation license evidence records CC BY-NC 4.0 and supports noncommercial processing subject to project governance.","public_release_or_redistribution":"NOT_AUTHORIZED","required_repair":"source-specific privacy, annotation, file-level release, attribution/noncommercial, and custody decisions"},"distribution_authorized":false,"human_annotation_authority_complete":false,"public_release_authorized":false,"source_group_id":"P27","source_id":"P27_101"},{"boundary":{"human_annotation_authority":"NOT_GRANTED_BY_TASK162_SOURCE_MANIFEST","license_evidence":"EPIC-KITCHENS-100 project/annotation license evidence records CC BY-NC 4.0 and supports noncommercial processing subject to project governance.","public_release_or_redistribution":"NOT_AUTHORIZED","required_repair":"source-specific privacy, annotation, file-level release, attribution/noncommercial, and custody decisions"},"distribution_authorized":false,"human_annotation_authority_complete":false,"public_release_authorized":false,"source_group_id":"P28","source_id":"P28_103"},{"boundary":{"dataset_license_statement":"Apache License 2.0","human_annotation_authority":"NOT_AUTHORIZED_BY_TASK188","operative_linked_consent_document_archived":false,"operative_linked_irb_document_archived":false,"public_release_or_redistribution":"NOT_AUTHORIZED","university_of_florida_irb_statement_verified":true,"use_boundary":"Restricted internal research only pending separate governance","written_participant_consent_statement_verified":true},"distribution_authorized":false,"human_annotation_authority_complete":false,"public_release_authorized":false,"source_group_id":"cc4d_p01_e08","source_id":"16_20"},{"boundary":{"dataset_license_statement":"Apache License 2.0","human_annotation_authority":"NOT_AUTHORIZED_BY_TASK188","operative_linked_consent_document_archived":false,"operative_linked_irb_document_archived":false,"public_release_or_redistribution":"NOT_AUTHORIZED","university_of_florida_irb_statement_verified":true,"use_boundary":"Restricted internal research only pending separate governance","written_participant_consent_statement_verified":true},"distribution_authorized":false,"human_annotation_authority_complete":false,"public_release_authorized":false,"source_group_id":"cc4d_p02_e02","source_id":"15_29"},{"boundary":{"dataset_license_statement":"Apache License 2.0","human_annotation_authority":"NOT_AUTHORIZED_BY_TASK188","operative_linked_consent_document_archived":false,"operative_linked_irb_document_archived":false,"public_release_or_redistribution":"NOT_AUTHORIZED","university_of_florida_irb_statement_verified":true,"use_boundary":"Restricted internal research only pending separate governance","written_participant_consent_statement_verified":true},"distribution_authorized":false,"human_annotation_authority_complete":false,"public_release_authorized":false,"source_group_id":"cc4d_p03_e03","source_id":"26_22"},{"boundary":{"human_annotation_authority":"NOT_ESTABLISHED","machine_provisional_processing":"AUTHORIZED_FOR_NARROW_LOCAL_MACHINE_MVP","ownership_license_or_release_rights":"NOT_ESTABLISHED","persistent_media_derivatives":"NOT_AUTHORIZED","public_release_or_redistribution":"NOT_AUTHORIZED","public_transcript_release":"PROHIBITED","required_repair":"source-specific rights, privacy, human annotation, release, and custody approval","restricted_acquisition":"AUTHORIZED_FOR_EXACT_LOCAL_OBJECT"},"distribution_authorized":false,"human_annotation_authority_complete":false,"public_release_authorized":false,"source_group_id":"cand-052","source_id":"cand-052"}],"schema_version":"1.0.0","scope":{"accepted_ses_count":0,"author_verifier_form_count":12,"excluded_calibration_count":2,"gate_a_go_asserted":false,"h1_count":0,"h2_count":0,"human_decision_count":0,"human_identity_count":0,"human_review_count":0,"null_role_assignment_count":72,"slot_count":12,"slots_per_source":2,"source_count":6,"task153_source_packet_count":6,"task194_audio_slot_count":4},"slot_packets":[{"accepted_ses_count":0,"audio_prescreen":{"blank_import_path":"slots/PV4-CC15-01/audio_prescreen/blank_import.json","blank_import_token":"AUDIO_CANDIDATE_PRESCREEN_PACKETS_REPAIR","candidate_code":"C01","candidate_hypotheses_visible":false,"form_path":"slots/PV4-CC15-01/audio_prescreen/reviewer_form.json","human_decision_count":0,"human_review_occurred":false,"inspection_order":["audio_only_focal","synchronized_av_focal","audio_only_recurrence_probes"],"packet_path":"slots/PV4-CC15-01/audio_prescreen/candidate_packet.json"},"author_verifier_form_path":"slots/PV4-CC15-01/author_verifier_form.json","author_verifier_form_sha256":"sha256:5837f776342b204d2958dbefb15ff3dabc6b9502e9f32a8abaf8e27dcf368120","blank_import_path":"slots/PV4-CC15-01/blank_import.json","blank_import_token":"PILOT_V4_HUMAN_PACKETS_REPAIR","candidate_slot_payload_sha256":"sha256:c3bce54a546ae686d3378dd335d98a7bf3301175e3ec0b606b08aba27c0b9275","distribution_authorized":false,"future_test_eligible":false,"gate_a_go":false,"h1_assigned":false,"h2_assigned":false,"human_decision_recorded":false,"human_review_performed":false,"slot_id":"PV4-CC15-01","source_group_id":"cc4d_p02_e02","source_id":"15_29","source_split":"DEVELOPMENT_ONLY","task153_plan_id":"task199-15_29-task153-plan","task153_plan_sha256":"sha256:efe9662102d51a7c1fedb4e163a74acf8f457467f090cd4822388643573b705c"},{"accepted_ses_count":0,"audio_prescreen":null,"author_verifier_form_path":"slots/PV4-CC15-02/author_verifier_form.json","author_verifier_form_sha256":"sha256:a1f06d675b49b2d31abb924b9059cbb1f5c7737eff44d5a4b0621de7252696a5","blank_import_path":"slots/PV4-CC15-02/blank_import.json","blank_import_token":"PILOT_V4_HU